{
  "schema_name": "target",
  "schema_version": "1.0.0",
  "target_id": "target-disk-nvme0n1",
  "target_type": "disk",
  "discovered_at": "2026-07-27T12:00:00Z",
  "display_name": "NVMe Disk 0",
  "stable_identity": {
    "disk_serial": "SN-TEST-001",
    "bus_path": "PCIROOT(0)#PCI(1D00)#PCI(0000)"
  },
  "runtime_locators": {
    "winpe_disk_number": "0",
    "mount_hint": "none"
  },
  "capabilities": ["read_sectors", "smart_available"],
  "limitations": ["write_blocked_by_policy"]
}
